,Topic,Count,Name,Representation,Representative_Docs
19,18,22,18_noise_food noise_food_thoughts,"['noise', 'food noise', 'food', 'thoughts', 'recovery', 'mental', 'noises', 'away', 'restricting', 'feel']","['For me personally, I’m pretty sure it had to do with my ADHD bc I have always had “food noise,” prior to any ED issues. Like my parents never restricted food from me, we never owned a scale, and are actually the two most intuitive eaters I know (all of this to say I don’t think I had an environmental reason to be so obsessive with food). Once I was diagnosed and medicated a few years ago, the food noise went away and I actually developed the healthiest relationship with food I have had in forever. I say t', 'Food Noise in AN Recovery. One of the most salient aspects for those on Ozempic/other drugs is the reduction of ""food noise"" – that incessant voice urging them to eat even if they are not hungry. As I\'ve engaged in recovery from Anorexia Nervosa, I\'m struck that my own ""food noise"" has been ratcheted up to <number> , even though I\'m weight restored and overshooting. Does this ever go away, or am I fated to be negotiating with these voices/urges for the rest of my life?', 'Food noise. I truly believe that food noise is behind a lot of ED behavior. Do you experience a lot of food noise? People who are on Ozempic say their food noise quiets down and I recognized what they were talking about immediately. Thoughts?']"
20,19,20,19_sorry_mom_mother_im sorry,"['sorry', 'mom', 'mother', 'im sorry', 'child', 'cant', 'going', 'im', 'adults', 'know']","['i understand, please dont be sorry i probably just misunderstood, life has been tough and i was probably just feeling defensive she definetly does but doesnt wanna listen to me when i try to help her out or take her out of denial, if you check my older posts i have multiple just asking about how i can make my mom realize she has an eating disorder. i really think she is using me as competition and thats whats hurting the most, i dont want to be the reason shes going out of her way to hurt herself even more', 'i cant, im sorry. i genuinely cant. you dont understand what kinda situations she puts herself in. i need to be there to take care of her. i know i shouldnt have to but i do. shes not forcing me to do it, noone is, but my conscience wouldnt allow me to just let her be. shes one of the only reasons im still alive. and please dont be sorry, its very horrible, but neither of my parents were ready to have a child and they did. i cant blame them because ever since the last second they didnt want to. and theyre t', 'i am <number> , yeah, please dont be sorry and thank you alot but this is just my life really and i love my mom. i wouldnt let her go no matter what and thats why im worried. i want to help her so desperately but a minor wanting to help an adult, specially their parent, feels almost impossible. also, yes.. but the other adults are so much worse. my mom is the best possible gaurdian i have. theres my father who has genuine religious psychosis, and always makes my ED worse, my mom makes comments and things that hurt']"
21,20,20,20_feel yup_feel_hear_yup,"['feel yup', 'feel', 'hear', 'yup', 'feel big time', 'experienced feel', 'experienced feel yup', 'exactly feel yup', 'another lvl', 'feel big']","['You yup I hear you!', 'omg I feel that on another lvl', 'yup I feel this big time']"
22,21,19,21_glp number_glp_number_glp1,"['glp number', 'glp', 'number', 'glp1', 'glp1s', 'weight', 'studies', 'people', 'weight loss', 'loss']","['Nope, don\'t care at all and I kind of wish mods would address this topic so we could stop getting this post daily. I\'ve said this on here before but weight management and weight loss *IS* part of type <number> diabetes management, treatment, and prevention, so it is silly to try to divide glp1 usage between ""valid diabetes prescription"" and ""dirty immoral evil weight loss prescription"" considering the majority of people on it for the former will be achieving the latter and vice versa. There is no evidence that t', 'As someone who’s deep in the GLP- <number> community for the last two years (and been in remission for BED that entire time), this is hardly universally true. Most people I know have lost upwards of <number> - <percent> of their bodyweight, including at least a dozen morbidly obese people who’ve lost <percent> and counting. Many people end up lowering their dose at maintenance because they can’t stop losing otherwise. That aside, the GLP- <number> craze is clearly part of the problem. You have countless people experiencing the high of heavy', 'I’ve used GLP-1s to lose >! <number> lbs!< over the last year. I had bariatric surgery before that, went from >!HW of <number> lbs, surgery day I was <number> , stopped losing around <number> and now I am <number> !< I wouldn’t have been able to lose that last bit without the GLP- <number> , despite my surgery. The medication turns off the food noise. The medication itself doesn’t actually make you lose weight, it just helps you make better decisions when it comes to food - you can still very easily be on a GLP- <number> and maintain or even gain, I k']"
23,22,18,22_lol_yes_omg_absolutely,"['lol', 'yes', 'omg', 'absolutely', 'absolutely knew', 'absolutely knew lol', 'absolutely maybe', 'absolutely maybe postjust', 'ago lol', 'ago lol theres']","['same lol 💀', 'OMG WAIT YEAH HAHAHAH', 'Or maybe this is the post….just realized this was 16d ago lol']"
24,23,18,23_ads_prescription_drugs_advertising,"['ads', 'prescription', 'drugs', 'advertising', 'live', 'ads prescription', 'see', 'usa', 'advertised', 'ad']","['I personally don’t care what people do for themselves (as long as that does not create a shortage of the drug for the people that medically need it), but the ads are driving me crazy. On the platforms I mainly see them on (FB and IG), there are explicit ad settings that let you turn off ads for alcohol (if you’re a recovering alcoholic) and child products (if you’ve lost a child and are grieving), so there does not seem to be any _good_ reason that you can’t turn off ads for drugs known for weight loss if', '🎶The laaaand of the FREEEEE🎶 -market. Lol. Yes, ads for prescription medicines are legal and omnipresent in the US. The phrase “ask your doctor if your heart is healthy enough for sexual activity” from a Viagra ad lives in far too much free real estate in my brain. Like other people can quote childhood cartoons, I can quote commercials targeting old dudes with limp dicks 😶', 'I’m currently inpatient in the UK, and it has been simultaneously hilarious and depressing recently because adds for wl drugs keep popping up on the radio we always have on in the dining room during meals and snacks. Poor staff have to keep jumping up to change the channel, bless them 😅 Edit: this clearly isn’t just a USA issue, the ads on the radio in the UK have been from private medical providers (which have been slowly proliferating for years), letting their target audience know that despite not being']"
25,24,15,24_weight_im_semaglutide_taking,"['weight', 'im', 'semaglutide', 'taking', 'ive', 'losing', 'obese', 'lose weight', 'eating', 'lose']","[""Back in the height of my ED sibutramine was all the rage, and in my mind I would take one pill and drop 30lbs just like that. Fast forward after covid the stupid endocrinologist prescribed it to me to lose some weight faster, it didn't work for shit other than making me sweat like a pig. I did keto and lost much faster and currently doing some fasting and losing even faster and feeling healthy and good. Medicine is not always the way, and no one is talking about the future side effects as our bodies tend"", 'I’m disappointed about some of the reactions to this medication on here, but also not surprised. Anything having to do with weight loss, how people lose weight, why people lose weight, if someone should lose weight, what constitutes disordered eating and EDs tend to be inflammatory topics that unfortunately continue to restrict a lot of our understanding of weight (gain & loss) and changing bodies. The cessation of the food noise when I started semaglutide was stunning. I didn’t even really grasp that f', 'My mother is taking it, she has been severely obese her entire adult life, someone who really does need the help as her visceral fat is severe and she is getting older, we have a good relationship, but I can see how it\'s leading to disordered restrictive behaviors in her, she gets so excited and happy to be losing weight and she tries to ride the high, she ""forgets"" to eat all day even though her entire life is run by her planner app on her phone and she never ""forgets"" anything else, the other day she got']"
26,25,15,25_quite bit_christmas_left_quite,"['quite bit', 'christmas', 'left', 'quite', 'christmas mom', 'bit', 'dad', 'parents', 'days', 'alone']","['my mom fr said she’d pay for my therapy last Christmas, owning the trauma she and my dad caused :)', ""When you say 'quite a bit', you mean quite a bit of hours or quite of bit of days?"", 'My Dad. I love him more than the world. He came for a ""visit"" aka I was dying and needed care. He left <number> days ago and I found his Ozempic pens in my fridge...']"
27,26,15,26_met_online_met online_say met,"['met', 'online', 'met online', 'say met', 'say met online', 'say', 'together', 'tell everyone met', 'everyone met', 'tell everyone']","['I met one of my exes on a discord anime roleplay server lol, sometimes it just be like that. just say you met online, extremely common these days. pretty sure I met every guy I’ve dated online (either discord or tinder)', 'Just say you met online/twitter. I met my partner in a different niche twitter community and just tell everyone we met online and leave it there lol', ""i met my boyfriend on edtwt and i have conflicted feelings about it. i had like <number> + followers and was posting just unhinged content - almost naked bodychecks, weird diets, raving about using ozempic 💀 this was six months ago, i've deleted it all since then i met a guy there who was also a user on edtwt (NOT a proana coach, he also has different problems with food and weight) we clicked and i guess bonded through our misery - we made a deal to delete all twitter accounts and to end all of this, and we actu""]"
28,27,14,27_ads_settings_reddit_apps,"['ads', 'settings', 'reddit', 'apps', 'weight loss ads', 'loss ads', 'account settings', 'browser', 'turn', 'account']","['If you are seeing ads on Reddit and want to turn them off you can limit specific topics. Go to settings, account settings, limit ads. It does help imo. Most of my ads are for Amazon products now.', 'I know for sure you can on Reddit and I’m pretty sure for instagram but some social media apps have the option to not see these ads. On Reddit go into account settings and you should be able to toggle off weight loss ads.', ""adblockers. common ones do not work on reddit. you may look into a network-level adblocker. one can be put on a raspberry pi fairly easily and hooked up as the access point to your network. even if you've got little technical skill a tutorial should help you achieve this pretty easily. this will block ads at a network level which no website can really prevent. side note--are you cis M? you mentioned taking hormones. were you prescribed these because your hormone levels are permanently fucked from restricti""]"
29,28,14,28_triggering_youre okay_hope youre okay_hope,"['triggering', 'youre okay', 'hope youre okay', 'hope', 'hope youre', 'im sorry', 'sorry', 'feel', 'sounds like', 'youre']","['I’m so glad you posted this. It makes me feel absolutely crazy and I feel so alone', 'shit im sorry :/ it doesn’t, but i’m sure it helps in ways i don’t understand cause my privilege is invisible to me. i hope you are doing well < <number>', ""Oh wow. Hope you're doing okay after the disappointment. <percent> feel you on the 'if this happens, my life will CHANGE FOR THE BETTER' vibe.""]"
30,29,13,29_dita_dita von_dita von teese_dont understand someone,"['dita', 'dita von', 'dita von teese', 'dont understand someone', 'gonna ok soul', 'gonna ok', 'ok soul tiktoxic', 'peaches', 'ok soul', 'honestly dont understand']","['❤️ we gonna be ok', ""I honestly don't understand how someone can be that unaware😭"", 'Dita Von Teese, peaches 🍑']"
31,30,12,30_tiktok_girls_like_content,"['tiktok', 'girls', 'like', 'content', 'tiktok page', 'tiktok ive', 'designed make', 'ed content', 'stitch', 'trends im']","[""Some won't realise that tiktok is designed to make you more vulnerable, self conscious, upset, so that then you'd be more willing to spend money on products that supposedly should make your life all better, you could be *that girl* if you buy this or that. On top of that - self confidence issues that might never go away, mostly inflicted by artificial environment of social media. All designed to make you feel like you're not enough, like your life could be better, all by showing fake content of fake people."", ""My ed is online public for everyone. So I have a TikTok page, and I don't have a lot of followers (almost <number> though yay!) But I do have a lot of views because of my nerdy content, our rants nothing to do with my e.d. It's been posting a few times a week consistently for over <number> years and scrolling down my TikTok page, you can see the weight loss overtime and one if my followers commented about it. In the beginning (a little over a year) of my eating disorder, I did stitch a video about somebody fatshamin"", 'tiktok is insane.. just redownloaded tiktok and my feed is like: How I Lost <number> Pounds From Ozempic – Everyone Must Try This! *shows them eating like >! <number> !< cals a day and losing clumps of hair but it’s all fine bc it’s a medication not a disorder* (bonus points if there’s a stitch from a doctor reaffirming how normal and healthy losing hair and shitting yourself on weight loss medication is bc at least you’re losing weight) the exact same post but from someone who was never even overweight to begin wi']"
32,31,11,31_sorry_im sorry_sorry im sorry_sorry im,"['sorry', 'im sorry', 'sorry im sorry', 'sorry im', 'im', 'im sorry im', 'awful im', 'awful', 'begin describe', 'awful im truly']","['I’m so sorry that happened :( it causes such an icky feeling I can’t even begin to describe it.', ""I'm sorry. :("", 'I’m so sorry 🤦🏻\u200d♀️']"
33,32,11,32_ads_ozempic_ozempic ads_commercials,"['ads', 'ozempic', 'ozempic ads', 'commercials', 'ozempic ad', 'ad', 'day', 'ads annoying', 'scrolling', 'see']","['ozempic ads. not one goddamn day goes by without me getting triggered by an ozempic ad and wishing i had some of that on me.', 'Tired of all the weight loss ads . That’s it lol.. like every day I see multiple ads and it’s annoying. If Ozempic (amongst others) were invented in <number> then why is it being pushed so heavily now?', ""I'm in California and we get commercials on TV all day and night for Ozempic, Mounjaro, and another one called Wegovy. I feel like all I ever see are weight loss and erectile dysfunction medication commercials <number> / <number> !""]"
